{
  "$schema": "../schemas/treatment-decisions.schema.json",
  "$comment": "Decision-support content (score -> action, result -> action, treatment options with benefit/harm and patient modifiers). A shared clinical rule file: the web (lib/pane-engine/src/decision) and iOS (TreatmentDecisionContent.swift through SharedClinicalContent) read this one file; lint:shared-content checks it against clinical-content/schemas/treatment-decisions.schema.json and both platforms' types. EVERY number and wording NEEDS SURGEON SIGN-OFF: sources are cited from memory (fromMemory: true) and effect sizes marked evidence 'estimate' are the author's estimates from the cited trials, not trial results. Clinician-facing suggestions only.",
  "id": "treatment-decision-support",
  "version": "1.0.0",
  "status": "needs-sign-off",
  "defaults": {
    "confirmedFloor": 0.95,
    "minEngineProbability": 0.1,
    "maxDecisions": 4,
    "uln": {
      "lipase": 60,
      "amylase": 100,
      "troponin": 14
    },
    "ulnNote": "Default upper limits (lipase 60 U/L, amylase 100 U/L, hs-troponin T 14 ng/L) are placeholders: use the local laboratory reference range."
  },
  "sources": {
    "NICE-CG141": {
      "citation": "NICE CG141. Acute upper gastrointestinal bleeding in over 16s: management (2012, updated 2016).",
      "year": 2012,
      "fromMemory": true
    },
    "BARKUN-2019": {
      "citation": "Barkun AN et al. Management of nonvariceal upper gastrointestinal bleeding: guideline recommendations from the International Consensus Group. Ann Intern Med 2019;171:805-822.",
      "year": 2019,
      "fromMemory": true
    },
    "ESGE-2021-NVUGIH": {
      "citation": "Gralnek IM et al. Diagnosis and management of nonvariceal upper gastrointestinal hemorrhage: ESGE Guideline - update 2021. Endoscopy 2021;53:300-332.",
      "year": 2021,
      "fromMemory": true
    },
    "STANLEY-2017": {
      "citation": "Stanley AJ et al. Comparison of risk scoring systems for patients presenting with upper gastrointestinal bleeding: international multicentre prospective study. BMJ 2017;356:i6432.",
      "year": 2017,
      "fromMemory": true
    },
    "LAU-2020": {
      "citation": "Lau JYW et al. Timing of endoscopy for acute upper gastrointestinal bleeding. N Engl J Med 2020;382:1299-1308.",
      "year": 2020,
      "fromMemory": true
    },
    "ROCKALL-1996": {
      "citation": "Rockall TA et al. Risk assessment after acute upper gastrointestinal haemorrhage. Gut 1996;38:316-321.",
      "year": 1996,
      "fromMemory": true
    },
    "ALVARADO-1986": {
      "citation": "Alvarado A. A practical score for the early diagnosis of acute appendicitis. Ann Emerg Med 1986;15:557-564.",
      "year": 1986,
      "fromMemory": true
    },
    "AIR-2008": {
      "citation": "Andersson M, Andersson RE. The appendicitis inflammatory response score: a tool for the diagnosis of acute appendicitis that outperforms the Alvarado score. World J Surg 2008;32:1843-1849.",
      "year": 2008,
      "fromMemory": true
    },
    "WSES-2020-APP": {
      "citation": "Di Saverio S et al. Diagnosis and treatment of acute appendicitis: 2020 update of the WSES Jerusalem guidelines. World J Emerg Surg 2020;15:27.",
      "year": 2020,
      "fromMemory": true
    },
    "CODA-2020": {
      "citation": "CODA Collaborative. A randomized trial comparing antibiotics with appendectomy for appendicitis. N Engl J Med 2020;383:1907-1919.",
      "year": 2020,
      "fromMemory": true
    },
    "APPAC-2015": {
      "citation": "Salminen P et al. Antibiotic therapy vs appendectomy for uncomplicated acute appendicitis: the APPAC randomized clinical trial. JAMA 2015;313:2340-2348 (5-year follow-up JAMA 2018;320:1259-1265).",
      "year": 2015,
      "fromMemory": true
    },
    "RUD-2019": {
      "citation": "Rud B et al. Computed tomography for diagnosis of acute appendicitis in adults. Cochrane Database Syst Rev 2019;CD009977.",
      "year": 2019,
      "fromMemory": true
    },
    "TG18-CHOLECYSTITIS": {
      "citation": "Okamoto K et al. Tokyo Guidelines 2018: flowchart for the management of acute cholecystitis. J Hepatobiliary Pancreat Sci 2018;25:55-72.",
      "year": 2018,
      "fromMemory": true
    },
    "TG18-CHOLANGITIS": {
      "citation": "Miura F et al. Tokyo Guidelines 2018: initial management of acute biliary infection and flowchart for acute cholangitis. J Hepatobiliary Pancreat Sci 2018;25:31-40.",
      "year": 2018,
      "fromMemory": true
    },
    "CHOCOLATE-2018": {
      "citation": "Loozen CS et al. Laparoscopic cholecystectomy versus percutaneous catheter drainage for acute cholecystitis in high risk patients (CHOCOLATE): multicentre randomised clinical trial. BMJ 2018;363:k3965.",
      "year": 2018,
      "fromMemory": true
    },
    "KIEWIET-2012": {
      "citation": "Kiewiet JJS et al. A systematic review and meta-analysis of diagnostic performance of imaging in acute cholecystitis. Radiology 2012;264:708-720.",
      "year": 2012,
      "fromMemory": true
    },
    "DIABOLO-2017": {
      "citation": "Daniels L et al. Randomized clinical trial of observational versus antibiotic treatment for a first episode of CT-proven uncomplicated acute diverticulitis (DIABOLO). Br J Surg 2017;104:52-61.",
      "year": 2017,
      "fromMemory": true
    },
    "AVOD-2012": {
      "citation": "Chabok A et al. Randomized clinical trial of antibiotics in acute uncomplicated diverticulitis (AVOD). Br J Surg 2012;99:532-539.",
      "year": 2012,
      "fromMemory": true
    },
    "DINAMO-2021": {
      "citation": "Mora-Lopez L et al. Efficacy and safety of nonantibiotic outpatient treatment in mild acute diverticulitis (DINAMO-study). Ann Surg 2021;274:e435-e442.",
      "year": 2021,
      "fromMemory": true
    },
    "WSES-2020-DIV": {
      "citation": "Sartelli M et al. 2020 update of the WSES guidelines for the management of acute colonic diverticulitis in the emergency setting. World J Emerg Surg 2020;15:32.",
      "year": 2020,
      "fromMemory": true
    },
    "ESC-2019-PE": {
      "citation": "Konstantinides SV et al. 2019 ESC Guidelines for the diagnosis and management of acute pulmonary embolism. Eur Heart J 2020;41:543-603.",
      "year": 2019,
      "fromMemory": true
    },
    "NICE-NG158": {
      "citation": "NICE NG158. Venous thromboembolic diseases: diagnosis, management and thrombophilia testing (2020).",
      "year": 2020,
      "fromMemory": true
    },
    "PEITHO-2014": {
      "citation": "Meyer G et al. Fibrinolysis for patients with intermediate-risk pulmonary embolism (PEITHO). N Engl J Med 2014;370:1402-1411.",
      "year": 2014,
      "fromMemory": true
    },
    "PIOPED-II-2006": {
      "citation": "Stein PD et al. Multidetector computed tomography for acute pulmonary embolism (PIOPED II). N Engl J Med 2006;354:2317-2327.",
      "year": 2006,
      "fromMemory": true
    },
    "CHRISTOPHER-2006": {
      "citation": "van Belle A et al. Effectiveness of managing suspected pulmonary embolism using an algorithm combining clinical probability, D-dimer testing, and computed tomography (Christopher Study). JAMA 2006;295:172-179.",
      "year": 2006,
      "fromMemory": true
    },
    "WELLS-DVT-2003": {
      "citation": "Wells PS et al. Evaluation of D-dimer in the diagnosis of suspected deep-vein thrombosis. N Engl J Med 2003;349:1227-1235.",
      "year": 2003,
      "fromMemory": true
    },
    "NICE-NG89": {
      "citation": "NICE NG89. Venous thromboembolism in over 16s: reducing the risk of hospital-acquired deep vein thrombosis or pulmonary embolism (2018).",
      "year": 2018,
      "fromMemory": true
    },
    "ACCP-2012-VTE": {
      "citation": "Gould MK et al. Prevention of VTE in nonorthopedic surgical patients: Antithrombotic Therapy and Prevention of Thrombosis, 9th ed (ACCP). Chest 2012;141(2 Suppl):e227S-e277S.",
      "year": 2012,
      "fromMemory": true
    },
    "BAHL-2010": {
      "citation": "Bahl V et al. A validation study of a retrospective venous thromboembolism risk scoring method (Caprini). Ann Surg 2010;251:344-350.",
      "year": 2010,
      "fromMemory": true
    },
    "SSC-2021": {
      "citation": "Evans L et al. Surviving Sepsis Campaign: international guidelines for management of sepsis and septic shock 2021. Crit Care Med 2021;49:e1063-e1143.",
      "year": 2021,
      "fromMemory": true
    },
    "KUMAR-2006": {
      "citation": "Kumar A et al. Duration of hypotension before initiation of effective antimicrobial therapy is the critical determinant of survival in human septic shock. Crit Care Med 2006;34:1589-1596.",
      "year": 2006,
      "fromMemory": true
    },
    "SEYMOUR-2017": {
      "citation": "Seymour CW et al. Time to treatment and mortality during mandated emergency care for sepsis. N Engl J Med 2017;376:2235-2244.",
      "year": 2017,
      "fromMemory": true
    },
    "SEPSIS3-2016": {
      "citation": "Singer M et al. The Third International Consensus Definitions for Sepsis and Septic Shock (Sepsis-3). JAMA 2016;315:801-810.",
      "year": 2016,
      "fromMemory": true
    },
    "HERNIASURGE-2018": {
      "citation": "HerniaSurge Group. International guidelines for groin hernia management. Hernia 2018;22:1-165.",
      "year": 2018,
      "fromMemory": true
    },
    "FITZGIBBONS-2006": {
      "citation": "Fitzgibbons RJ et al. Watchful waiting vs repair of inguinal hernia in minimally symptomatic men: a randomized clinical trial. JAMA 2006;295:285-292.",
      "year": 2006,
      "fromMemory": true
    },
    "ODWYER-2006": {
      "citation": "O'Dwyer PJ et al. Observation or operation for patients with an asymptomatic inguinal hernia: a randomized clinical trial. Ann Surg 2006;244:167-173.",
      "year": 2006,
      "fromMemory": true
    },
    "PONCHO-2015": {